{
  "registryVersion": "scoremosaic-polyphonic-teacher-gold-registry-v1",
  "benchmarkId": "scoremosaic-polyphonic-teacher-gold-v1",
  "fixtureSchemaVersion": "scoremosaic-polyphonic-benchmark-fixture-v1",
  "minimumVerifiedFixtures": 500,
  "targetVerifiedFixtures": 1000,
  "fixtureRecords": [
    {
      "fixtureId": "poly_fixture_ossq_13744399_p1",
      "metadataRef": "fixtures/poly_fixture_ossq_13744399_p1.json",
      "metadataSha256": "30ef2979b60f8dd903b12b8dab29e424ce7eb68fbee8675252f7d5d9091393d4"
    },
    {
      "fixtureId": "poly_fixture_ossq_7313978_p1",
      "metadataRef": "fixtures/poly_fixture_ossq_7313978_p1.json",
      "metadataSha256": "c35479caeaf7992738649b75f6c86e95fffc1f6b9797f88d1fb52569c5baecf0"
    },
    {
      "fixtureId": "poly_fixture_ossq_7383977_p1",
      "metadataRef": "fixtures/poly_fixture_ossq_7383977_p1.json",
      "metadataSha256": "87a8da8e1529b256f2a8990f923f95af1949377a7135efe81adf5f641e60a923"
    },
    {
      "fixtureId": "poly_fixture_ossq_8071278_p1",
      "metadataRef": "fixtures/poly_fixture_ossq_8071278_p1.json",
      "metadataSha256": "bf03f19a0468c4cf8e9e5a3b8021e17bd7cf03ce9868cf77eb52771b8fea48df"
    },
    {
      "fixtureId": "poly_fixture_ossq_8454356_p1",
      "metadataRef": "fixtures/poly_fixture_ossq_8454356_p1.json",
      "metadataSha256": "d84f10d4832dbdaa6fbd5d2a94749984be39f09470013931599b59ce5b92a055"
    },
    {
      "fixtureId": "poly_fixture_openscore_osl_01_p1",
      "metadataRef": "fixtures/poly_fixture_openscore_osl_01_p1.json",
      "metadataSha256": "cc4c0776f3152f9e37831d1a51e8a5293ee3b2b19d871314fcdddd24c6f30a52"
    },
    {
      "fixtureId": "poly_fixture_openscore_osl_02_p1",
      "metadataRef": "fixtures/poly_fixture_openscore_osl_02_p1.json",
      "metadataSha256": "e80ccce54a8fdb14b00041565ab9baa2483281733cbb69b2f50ad4f81da562bf"
    },
    {
      "fixtureId": "poly_fixture_openscore_osl_03_p1",
      "metadataRef": "fixtures/poly_fixture_openscore_osl_03_p1.json",
      "metadataSha256": "b826a6e4a2e551587b3242c75cfcd7cc95b4555cf19e659940edffc98538c80d"
    },
    {
      "fixtureId": "poly_fixture_openscore_osl_04_p1",
      "metadataRef": "fixtures/poly_fixture_openscore_osl_04_p1.json",
      "metadataSha256": "8013e2658193d380374d9c8c735662016ec529e010b8a08dcda42c815eeac603"
    },
    {
      "fixtureId": "poly_fixture_openscore_osl_05_p1",
      "metadataRef": "fixtures/poly_fixture_openscore_osl_05_p1.json",
      "metadataSha256": "b76c324340be5bea972817a2cc2c612f9dd10dc2af3b20b8e6fdab8fea9786d6"
    }
  ],
  "boundaries": {
    "researchEvaluationOnly": true,
    "privateAssetsRemainExternal": true,
    "teacherGoldSeparateFromEngineOutputs": true,
    "teacherCorrectionAutomaticallyTrainingData": false,
    "automaticWinnerSelection": false,
    "automaticMusicXmlMerge": false,
    "automaticSemanticRepair": false,
    "teacherAuthority": true,
    "productionDecisionAuthority": false
  }
}
